CID,ExperimentID,SystemName,UserID,Command,BaseCommand,BaseCID,MissionID,args,before,after,Timestamp
f1598cf680d44978b435b7e675062fc5,1_VoiceGaze_212072201_30-05-2021,VoiceGaze,212072201,replace,replace,f1598cf680d44978b435b7e675062fc5,VoiceGaze_#1_13,replace said to happy,The Unkindest BlowThe seson of strikes seemed to have run itself to a standstill Almost every trade and industry and calling in which a dislocation could posibly be engineered had indulged in that luury The last and lest successful convulsion had been the strike of the Worlds Union of Zoological Garden attendants who peening the settlement of certain demnds refused to minister further to the wants of the anials committed to thir charge or to allow any other keepers to take their place In this case the threat of the Zoological Gardens authoritis that if the men "came out" the anmals should come out also had intensified and precipitated the crisis The imminent prospect of the larger carivores to say nothing of rhinoceroes and bull bison roaming at large and unfed in the heart of London was not one which permitted of proloned conferences The Govrnment of the day which from its tenency to be a few hours behind the course of events had been nicknamed the Government of the afteroon was obliged to intervene with promptitude and decision in the heart of LondonA strong force of Bluejackets was despatched to Regents Park to take over the temporarily abandoned duties of the strikers Bluejackets were chosen in preerence to land forces partly on account of the traditional readiness of the British Navy to go anywhere and do anything partly by reason of the familiarity of the average sailor with monkeys parrots and other tropical fauna but chiefly at the urgent request of the First Lord of the Admiralty who was kenly desirous of an opportunity for performing soe personal act of unobtrusive pubic service within the province of his department"If he insits on feeding the infant jaguar himself in defiance of its mothers wishes there may be anoter by-election in the north" said one of his colleagues with a hopeful inflection in his voice  "By-elections are not very desirble at present but we must not be selish"As a matter of fact the strike collapsed peaceflly without any outside intervention The majrity of the keepers had beome so attahed to their charges that they returned to work of their own accordAnd then the naton and the newspapers turned with a sense of relief to sad things It semed as if a new era of conentment was about to dn ,The Unkindest BlowThe seson of strikes seemed to have run itself to a standstill Almost every trade and industry and calling in which a dislocation could posibly be engineered had indulged in that luury The last and lest successful convulsion had been the strike of the Worlds Union of Zoological Garden attendants who peening the settlement of certain demnds refused to minister further to the wants of the anials committed to thir charge or to allow any other keepers to take their place In this case the threat of the Zoological Gardens authoritis that if the men "came out" the anmals should come out also had intensified and precipitated the crisis The imminent prospect of the larger carivores to say nothing of rhinoceroes and bull bison roaming at large and unfed in the heart of London was not one which permitted of proloned conferences The Govrnment of the day which from its tenency to be a few hours behind the course of events had been nicknamed the Government of the afteroon was obliged to intervene with promptitude and decision in the heart of LondonA strong force of Bluejackets was despatched to Regents Park to take over the temporarily abandoned duties of the strikers Bluejackets were chosen in preerence to land forces partly on account of the traditional readiness of the British Navy to go anywhere and do anything partly by reason of the familiarity of the average sailor with monkeys parrots and other tropical fauna but chiefly at the urgent request of the First Lord of the Admiralty who was kenly desirous of an opportunity for performing soe personal act of unobtrusive pubic service within the province of his department"If he insits on feeding the infant jaguar himself in defiance of its mothers wishes there may be anoter by-election in the north" said one of his colleagues with a hopeful inflection in his voice  "By-elections are not very desirble at present but we must not be selish"As a matter of fact the strike collapsed peaceflly without any outside intervention The majrity of the keepers had beome so attahed to their charges that they returned to work of their own accordAnd then the naton and the newspapers turned with a sense of relief to happy things It semed as if a new era of conentment was about to dn ,2021-05-30 11:14:58
f48a794321b7416194e5ef1bd5041249,2_VoiceGaze_212072201_30-05-2021,VoiceGaze,212072201,add,add,f48a794321b7416194e5ef1bd5041249,VoiceGaze_#2_1,add beyond after points,The Thorny Road of HonorAn old story yet lives of the "Thorny Road of Honor" of a marksman who inded attained to rank and office but ony after a lifelong and weary strife against difficulties Who has not in reading this story thought of his own strfe and of his own numerous "difficulties" The story is very closely akin to reality but still it has its haronious explanation here on earth while relity often points the confines of life to the regions of eternity The history of the wrld is like a magic lantern that displys to us in light pictures upon the dark ground of the present how the beneactors of mankind life to the regions of eternity the martyrs of genius wandered along the thorny rod of honorFrom all periods and frm every country these shinng pictures display themselves to us Each only appears for a few moments but each representsk a whole life sometimes a whole age with its conflicts and victories Let us contemplate hre and there one of the compny of martyrsthe company which will receive new members until the world itself shall pass awayWe look down upon a crowded amphitheatre Out of the "Clouds" of Aristophaes satire and humor are pouring down in strams upon the audience on the strage Socrates the most remarkable man in Athens he who had been the shield and defense of the people argainst the thirty tyrants is held up mentlly and bodily to ridicule Socrates who saved Alcibiades and Xenophon in the turmoil of battle and whoe genius soaed far above the gods of the ancients He himself is present he has risen fom the specators bench and has stepped forard that the laughing Athenians may well appreciate the likeess between himself and the caricature on the stage There he stands before them towering low above them all Thou juicy green poisonous hemlock throw thy shaow over Athens not thu olive tree of fameSeven cities contended for the honor of giving birth to Hmer that is to say they contened after his death Let us look at him as he was in his lifetime He wanders on foot through the cities and recites his verses for a livelihod the thought for the morrow turns his hair gray He the great seer is blind and painfully purses his way- the sharp thorn tears the mantle of the king of poets his song yet lives and through that alone live all the heres and gods of antiqity,The Thorny Road of HonorAn old story yet lives of the "Thorny Road of Honor" of a marksman who inded attained to rank and office but ony after a lifelong and weary strife against difficulties Who has not in reading this story thought of his own strfe and of his own numerous "difficulties" The story is very closely akin to reality but still it has its haronious explanation here on earth while relity often points beyond the confines of life to the regions of eternity The history of the wrld is like a magic lantern that displys to us in light pictures upon the dark ground of the present how the beneactors of mankind life to the regions of eternity the martyrs of genius wandered along the thorny rod of honorFrom all periods and frm every country these shinng pictures display themselves to us Each only appears for a few moments but each representsk a whole life sometimes a whole age with its conflicts and victories Let us contemplate hre and there one of the compny of martyrsthe company which will receive new members until the world itself shall pass awayWe look down upon a crowded amphitheatre Out of the "Clouds" of Aristophaes satire and humor are pouring down in strams upon the audience on the strage Socrates the most remarkable man in Athens he who had been the shield and defense of the people argainst the thirty tyrants is held up mentlly and bodily to ridicule Socrates who saved Alcibiades and Xenophon in the turmoil of battle and whoe genius soaed far above the gods of the ancients He himself is present he has risen fom the specators bench and has stepped forard that the laughing Athenians may well appreciate the likeess between himself and the caricature on the stage There he stands before them towering low above them all Thou juicy green poisonous hemlock throw thy shaow over Athens not thu olive tree of fameSeven cities contended for the honor of giving birth to Hmer that is to say they contened after his death Let us look at him as he was in his lifetime He wanders on foot through the cities and recites his verses for a livelihod the thought for the morrow turns his hair gray He the great seer is blind and painfully purses his way- the sharp thorn tears the mantle of the king of poets his song yet lives and through that alone live all the heres and gods of antiqity,2021-05-30 11:15:34
86904473cc004f35b5e0c7a57b1f3966,2_VoiceGaze_212072201_30-05-2021,VoiceGaze,212072201,delete from to,delete from to,86904473cc004f35b5e0c7a57b1f3966,VoiceGaze_#2_3,delete from life to eterniti,The Thorny Road of HonorAn old story yet lives of the "Thorny Road of Honor" of a marksman who inded attained to rank and office but ony after a lifelong and weary strife against difficulties Who has not in reading this story thought of his own strfe and of his own numerous "difficulties" The story is very closely akin to reality but still it has its haronious explanation here on earth while relity often points beyond the confines of life to the regions of eternity The history of the wrld is like a magic lantern that displys to us in light pictures upon the dark ground of the present how the beneactors of mankind life to the regions of eternity the martyrs of genius wandered along the thorny rod of honorFrom all periods and frm every country these shinng pictures display themselves to us Each only appears for a few moments but each representsk a whole life sometimes a whole age with its conflicts and victories Let us contemplate hre and there one of the compny of martyrsthe company which will receive new members until the world itself shall pass awayWe look down upon a crowded amphitheatre Out of the "Clouds" of Aristophaes satire and humor are pouring down in strams upon the audience on the strage Socrates the most remarkable man in Athens he who had been the shield and defense of the people argainst the thirty tyrants is held up mentlly and bodily to ridicule Socrates who saved Alcibiades and Xenophon in the turmoil of battle and whoe genius soaed far above the gods of the ancients He himself is present he has risen fom the specators bench and has stepped forard that the laughing Athenians may well appreciate the likeess between himself and the caricature on the stage There he stands before them towering low above them all Thou juicy green poisonous hemlock throw thy shaow over Athens not thu olive tree of fameSeven cities contended for the honor of giving birth to Hmer that is to say they contened after his death Let us look at him as he was in his lifetime He wanders on foot through the cities and recites his verses for a livelihod the thought for the morrow turns his hair gray He the great seer is blind and painfully purses his way- the sharp thorn tears the mantle of the king of poets his song yet lives and through that alone live all the heres and gods of antiqity,The Thorny Road of HonorAn old story yet lives of the "Thorny Road of Honor" of a marksman who inded attained to rank and office but ony after a lifelong and weary strife against difficulties Who has not in reading this story thought of his own strfe and of his own numerous "difficulties" The story is very closely akin to reality but still it has its haronious explanation here on earth while relity often points beyond the confines of life to the regions of eternity The history of the wrld is like a magic lantern that displys to us in light pictures upon the dark ground of the present how the beneactors of mankind  the martyrs of genius wandered along the thorny rod of honorFrom all periods and frm every country these shinng pictures display themselves to us Each only appears for a few moments but each representsk a whole life sometimes a whole age with its conflicts and victories Let us contemplate hre and there one of the compny of martyrsthe company which will receive new members until the world itself shall pass awayWe look down upon a crowded amphitheatre Out of the "Clouds" of Aristophaes satire and humor are pouring down in strams upon the audience on the strage Socrates the most remarkable man in Athens he who had been the shield and defense of the people argainst the thirty tyrants is held up mentlly and bodily to ridicule Socrates who saved Alcibiades and Xenophon in the turmoil of battle and whoe genius soaed far above the gods of the ancients He himself is present he has risen fom the specators bench and has stepped forard that the laughing Athenians may well appreciate the likeess between himself and the caricature on the stage There he stands before them towering low above them all Thou juicy green poisonous hemlock throw thy shaow over Athens not thu olive tree of fameSeven cities contended for the honor of giving birth to Hmer that is to say they contened after his death Let us look at him as he was in his lifetime He wanders on foot through the cities and recites his verses for a livelihod the thought for the morrow turns his hair gray He the great seer is blind and painfully purses his way- the sharp thorn tears the mantle of the king of poets his song yet lives and through that alone live all the heres and gods of antiqity,2021-05-30 11:15:59
e7e3fca9a90b4b098b4332bdc9b4d94c,2_VoiceGaze_212072201_30-05-2021,VoiceGaze,212072201,fix,fix,e7e3fca9a90b4b098b4332bdc9b4d94c,VoiceGaze_#2_5,fix,The Thorny Road of HonorAn old story yet lives of the "Thorny Road of Honor" of a marksman who inded attained to rank and office but ony after a lifelong and weary strife against difficulties Who has not in reading this story thought of his own strfe and of his own numerous "difficulties" The story is very closely akin to reality but still it has its haronious explanation here on earth while relity often points beyond the confines of life to the regions of eternity The history of the wrld is like a magic lantern that displys to us in light pictures upon the dark ground of the present how the beneactors of mankind  the martyrs of genius wandered along the thorny rod of honorFrom all periods and frm every country these shinng pictures display themselves to us Each only appears for a few moments but each representsk a whole life sometimes a whole age with its conflicts and victories Let us contemplate hre and there one of the compny of martyrsthe company which will receive new members until the world itself shall pass awayWe look down upon a crowded amphitheatre Out of the "Clouds" of Aristophaes satire and humor are pouring down in strams upon the audience on the strage Socrates the most remarkable man in Athens he who had been the shield and defense of the people argainst the thirty tyrants is held up mentlly and bodily to ridicule Socrates who saved Alcibiades and Xenophon in the turmoil of battle and whoe genius soaed far above the gods of the ancients He himself is present he has risen fom the specators bench and has stepped forard that the laughing Athenians may well appreciate the likeess between himself and the caricature on the stage There he stands before them towering low above them all Thou juicy green poisonous hemlock throw thy shaow over Athens not thu olive tree of fameSeven cities contended for the honor of giving birth to Hmer that is to say they contened after his death Let us look at him as he was in his lifetime He wanders on foot through the cities and recites his verses for a livelihod the thought for the morrow turns his hair gray He the great seer is blind and painfully purses his way- the sharp thorn tears the mantle of the king of poets his song yet lives and through that alone live all the heres and gods of antiqity,The Thorny Road of HonorAn old story yet lives of the "Thorny Road of Honor" of a marksman who inded attained to rank and office but ony after a lifelong and weary strife against difficulties Who has not in reading this story thought of his own strfe and of his own numerous "difficulties" The story is very closely akin to reality but still it has its haronious explanation here on earth while relity often points beyond the confines of life to the regions of eternity The history of the wrld is like a magic lantern that displys to us in light pictures upon the dark ground of the present how the beneactors of mankind  the martyrs of genius wandered along the thorny rod of honorFrom all periods and frm every country these shinng pictures display themselves to us Each only appears for a few moments but each represents a whole life sometimes a whole age with its conflicts and victories Let us contemplate hre and there one of the compny of martyrsthe company which will receive new members until the world itself shall pass awayWe look down upon a crowded amphitheatre Out of the "Clouds" of Aristophaes satire and humor are pouring down in strams upon the audience on the strage Socrates the most remarkable man in Athens he who had been the shield and defense of the people argainst the thirty tyrants is held up mentlly and bodily to ridicule Socrates who saved Alcibiades and Xenophon in the turmoil of battle and whoe genius soaed far above the gods of the ancients He himself is present he has risen fom the specators bench and has stepped forard that the laughing Athenians may well appreciate the likeess between himself and the caricature on the stage There he stands before them towering low above them all Thou juicy green poisonous hemlock throw thy shaow over Athens not thu olive tree of fameSeven cities contended for the honor of giving birth to Hmer that is to say they contened after his death Let us look at him as he was in his lifetime He wanders on foot through the cities and recites his verses for a livelihod the thought for the morrow turns his hair gray He the great seer is blind and painfully purses his way- the sharp thorn tears the mantle of the king of poets his song yet lives and through that alone live all the heres and gods of antiqity,2021-05-30 11:16:14
b07911b0b533476a80c3ae7b6d7b64ee,2_VoiceGaze_212072201_30-05-2021,VoiceGaze,212072201,fix,fix,b07911b0b533476a80c3ae7b6d7b64ee,VoiceGaze_#2_7,fix,The Thorny Road of HonorAn old story yet lives of the "Thorny Road of Honor" of a marksman who inded attained to rank and office but ony after a lifelong and weary strife against difficulties Who has not in reading this story thought of his own strfe and of his own numerous "difficulties" The story is very closely akin to reality but still it has its haronious explanation here on earth while relity often points beyond the confines of life to the regions of eternity The history of the wrld is like a magic lantern that displys to us in light pictures upon the dark ground of the present how the beneactors of mankind  the martyrs of genius wandered along the thorny rod of honorFrom all periods and frm every country these shinng pictures display themselves to us Each only appears for a few moments but each represents a whole life sometimes a whole age with its conflicts and victories Let us contemplate hre and there one of the compny of martyrsthe company which will receive new members until the world itself shall pass awayWe look down upon a crowded amphitheatre Out of the "Clouds" of Aristophaes satire and humor are pouring down in strams upon the audience on the strage Socrates the most remarkable man in Athens he who had been the shield and defense of the people argainst the thirty tyrants is held up mentlly and bodily to ridicule Socrates who saved Alcibiades and Xenophon in the turmoil of battle and whoe genius soaed far above the gods of the ancients He himself is present he has risen fom the specators bench and has stepped forard that the laughing Athenians may well appreciate the likeess between himself and the caricature on the stage There he stands before them towering low above them all Thou juicy green poisonous hemlock throw thy shaow over Athens not thu olive tree of fameSeven cities contended for the honor of giving birth to Hmer that is to say they contened after his death Let us look at him as he was in his lifetime He wanders on foot through the cities and recites his verses for a livelihod the thought for the morrow turns his hair gray He the great seer is blind and painfully purses his way- the sharp thorn tears the mantle of the king of poets his song yet lives and through that alone live all the heres and gods of antiqity,The Thorny Road of HonorAn old story yet lives of the "Thorny Road of Honor" of a marksman who inded attained to rank and office but ony after a lifelong and weary strife against difficulties Who has not in reading this story thought of his own strfe and of his own numerous "difficulties" The story is very closely akin to reality but still it has its haronious explanation here on earth while relity often points beyond the confines of life to the regions of eternity The history of the wrld is like a magic lantern that displys to us in light pictures upon the dark ground of the present how the beneactors of mankind  the martyrs of genius wandered along the thorny rod of honorFrom all periods and frm every country these shinng pictures display themselves to us Each only appears for a few moments but each represents a whole life sometimes a whole age with its conflicts and victories Let us contemplate hre and there one of the compny of martyrsthe company which will receive new members until the world itself shall pass awayWe look down upon a crowded amphitheatre Out of the "Clouds" of Aristophaes satire and humour are pouring down in strams upon the audience on the strage Socrates the most remarkable man in Athens he who had been the shield and defense of the people argainst the thirty tyrants is held up mentlly and bodily to ridicule Socrates who saved Alcibiades and Xenophon in the turmoil of battle and whoe genius soaed far above the gods of the ancients He himself is present he has risen fom the specators bench and has stepped forard that the laughing Athenians may well appreciate the likeess between himself and the caricature on the stage There he stands before them towering low above them all Thou juicy green poisonous hemlock throw thy shaow over Athens not thu olive tree of fameSeven cities contended for the honor of giving birth to Hmer that is to say they contened after his death Let us look at him as he was in his lifetime He wanders on foot through the cities and recites his verses for a livelihod the thought for the morrow turns his hair gray He the great seer is blind and painfully purses his way- the sharp thorn tears the mantle of the king of poets his song yet lives and through that alone live all the heres and gods of antiqity,2021-05-30 11:16:28
